timestamp,message
2025-02-17 12:05:00,I’d like to order The Green Garden Vegan Burger with extra avocado and Sweet Potato Fries.
2025-02-17 12:06:00,Can I order a pork burger with bacon?
2025-02-17 12:07:00,Where can I pick up my order?
2025-02-17 12:08:00,What healthy options do you have on the menu?
2025-02-17 12:09:00,"I’d like a Spicy Tempeh Burger without the jalapeños, please."
2025-02-17 12:10:00,Order: Give me a double cheeseburger.
2025-02-17 12:11:00,I want a Grilled Chicken Avocado Burger with Kale Chips.
2025-02-17 12:12:00,Do you deliver to 123 Elm Street?
2025-02-17 12:13:00,"I’d like a Vegan Burger combo, thanks."
2025-02-17 12:14:00,Can I order a Mediterranean Burger with extra feta?
2025-02-17 12:15:00,Order: I want The Powerhouse Superfood Burger and a Cold Brew Coffee.
2025-02-17 12:16:00,Could you tell me if I can get a turkey burger? (I don’t see it on your menu)
2025-02-17 12:17:00,I’d like to order a Chicken Caesar Wrap and a Freshly Squeezed Juice.
2025-02-17 12:18:00,What's the current wait time for an order?
2025-02-17 12:19:00,Order: I want a Vegan Burger with extra pickles.
2025-02-17 12:20:00,Can you order me a Fruit Parfait with extra honey?
2025-02-17 12:21:00,I’m interested in the menu—what desserts do you offer?
2025-02-17 12:22:00,Order: Please give me a baked cinnamon apple dessert.
2025-02-17 12:23:00,"Hi, your service is amazing!"
2025-02-17 12:24:00,Order: I want a Sweet Potato Fries and a Kombucha.
2025-02-17 12:25:00,"I’d like to order a Vegan Burger with a side of kale chips, but can I substitute avocado for tomato?"
2025-02-17 12:09:00,"I’d like a Spicy Tempeh Burger without jalapeños, please."
2025-02-17 12:16:00,Could you tell me if I can get a turkey burger? I don't see it on your menu.
2025-02-17 12:21:00,I'm interested in the menu—what desserts do you offer?
2025-02-17 12:22:00,Order: Please give me a Baked Cinnamon Apples dessert.
2025-02-17 12:24:00,Order: I want Sweet Potato Fries and a Kombucha.
2025-02-17 12:26:00,Please give me a Grilled Veggie & Hummus Wrap.
2025-02-17 12:27:00,I want the Chicken Caesar Wrap with extra dressing.
2025-02-17 12:28:00,Can you tell me what time you close?
2025-02-17 12:29:00,Order: I'd like a Mediterranean Chickpea Salad with a side of Freshly Squeezed Apple Juice.
2025-02-17 12:30:00,"I'd like to order a Turkish Burger, please."
2025-02-17 12:31:00,What are your specials for today?
2025-02-17 12:32:00,Order: Give me a Kale & Quinoa Super Salad with a dash of extra lemon.
2025-02-17 12:33:00,I want a Baked Cinnamon Apples dessert.
2025-02-17 12:34:00,Can I get a Vegan Burger combo with gluten-free bun?
2025-02-17 12:35:00,Order: I'd like a Grilled Chicken Avocado Burger without the yogurt-herb sauce.
2025-02-17 12:36:00,"I’m just browsing, thanks."
2025-02-17 12:37:00,Do you have any promotions today?
2025-02-17 12:38:00,Order: I'll take a Spicy Tempeh Burger and a Freshly Squeezed Carrot-Ginger Juice.
2025-02-17 12:39:00,Can I modify my order if I want less dressing?
2025-02-17 12:40:00,"Order: I'd like a Vegan Burger with extra avocado, a Grilled Veggie & Hummus Wrap, and Sweet Potato Fries."
2025-02-17 12:41:00,Is it possible to get a dessert with my order?
2025-02-17 12:42:00,Order: I want a Chia Pudding dessert.
2025-02-17 12:27:00,I want a Chicken Caesar Wrap with extra dressing.
2025-02-17 12:36:00,"I'm just browsing, thanks."
2025-02-17 12:43:00,I’d like to order The Green Garden Vegan Burger with extra avocado.
2025-02-17 12:44:00,"Could I get a Grilled Chicken Avocado Burger, please?"
2025-02-17 12:45:00,"Order: I'd like a Mediterranean Burger, please."
2025-02-17 12:46:00,Do you serve Chicken Tenders?
2025-02-17 12:47:00,Order: I want a Chicken Caesar Wrap with Freshly Squeezed Orange Juice.
2025-02-17 12:48:00,Is it possible to get extra dressing with my salad?
2025-02-17 12:49:00,"Order: Give me a Vegan Burger combo, no sauce."
2025-02-17 12:50:00,What are your delivery hours?
2025-02-17 12:51:00,Order: I'd like a Kale & Quinoa Super Salad with extra almonds.
2025-02-17 12:52:00,Can I order a Grilled Veggie & Hummus Wrap with extra hummus?
2025-02-17 12:53:00,Order: I'd like a Mediterranean Chickpea Salad with extra olives.
2025-02-17 12:54:00,I’d like to order a Vegan Burger with a side of Sweet Potato Fries.
2025-02-17 12:55:00,Order: I want a Turkish Burger.
2025-02-17 12:56:00,Can you tell me if I can get a Quinoa Salad?
2025-02-17 12:57:00,"Order: I want a Chicken Caesar Wrap, extra croutons."
2025-02-17 12:58:00,"I need help, my order is delayed."
2025-02-17 12:59:00,Order: I'd like a Cold Brew Coffee.
2025-02-17 13:00:00,What is the price of The Powerhouse Superfood Burger?
2025-02-17 13:01:00,Order: I want a Vegan Burger combo with extra pickles.
2025-02-17 13:02:00,Do you accept cash on delivery?
2025-02-17 13:03:00,Order: Please give me a Grilled Chicken Avocado Burger with extra spinach.
2025-02-17 13:04:00,I’d like to order a Chia Pudding dessert with fresh berries.
2025-02-17 13:05:00,Can you add a Freshly Squeezed Juice to my order?
2025-02-17 13:06:00,Order: I'd like a Grilled Veggie & Hummus Wrap and a Kombucha.
2025-02-17 13:07:00,I'm having trouble deciding; what do you recommend?
2025-02-17 13:08:00,"Order: I want a Spicy Tempeh Burger and a Freshly Squeezed Carrot-Ginger Juice, extra spice."
2025-02-17 13:09:00,Can I order a dessert if I order a salad?
2025-02-17 13:10:00,Order: I'd like a Mediterranean Chickpea Salad with a side of Freshly Squeezed Apple Juice and extra lemon.
2025-02-17 13:11:00,What is the estimated delivery time?
2025-02-17 13:12:00,Order: Please get me a Vegan Burger with extra avocado and a Cold Brew Coffee.
2025-02-17 13:13:00,I would like to order a healthy burger with no cheese.
2025-02-17 13:14:00,Order: I'd like a Grilled Chicken Avocado Burger with no sauce.
2025-02-17 13:15:00,Can I order one of the Vegan Burger options with a side of Sweet Potato Fries?
2025-02-17 13:16:00,Order: I want a Grilled Veggie & Hummus Wrap with extra hummus.
2025-02-17 13:17:00,Do you offer gluten-free burger buns?
2025-02-17 13:18:00,Order: I'd like a Mediterranean Chickpea Salad to go.
2025-02-17 13:19:00,Can you tell me what beverages you offer?
2025-02-17 13:20:00,Order: I'd like a Turkey Quinoa Burger with extra avocado.
2025-02-17 13:21:00,Is the Vegan Burger gluten-free?
2025-02-17 13:22:00,Order: Please give me a Grilled Chicken Avocado Burger.
2025-02-17 13:23:00,We just need a Vegan Burger consommé tonight.
2025-02-17 13:25:00,What’s the price of the Kale & Quinoa Super Salad?
2025-02-17 13:26:00,"I'm having some special guests tonight, do you have anything for dessert?"
2025-02-17 13:27:00,Can I get a Turkish Burger?
2025-02-17 13:28:00,Order: I'd like a Chicken Caesar Wrap and Sweet Potato Fries.
2025-02-17 13:29:00,Sure! We’ll be leaving for delivery soon.
2025-02-17 13:30:00,"Let’s take a quick look, let me get back to you."
2025-02-17 13:31:00,Order: I want a Grilled Veggie & Hummus Wrap and a Freshly Squeezed Orange Juice.
2025-02-17 13:32:00,"Order time, is it currently open?"
2025-02-17 13:33:00,I want my Vegan-order deeper tonight.
2025-02-17 13:34:00,Can wait for any answers from tonight!
2025-02-17 13:35:00,Order morning running will too be great opportunity.
2025-02-17 13:37:00,Would love checking your page calling.
2025-02-17 22:05:00,Order: I’d like to order The Green Garden Vegan Burger with extra avocado.
2025-02-17 22:10:00,Order: I’d like a Spicy Tempeh Burger with extra spice.
2025-02-17 22:15:00,Order: Can I get a Cold Brew Coffee with my order?
2025-02-17 22:25:00,What are your delivery times tonight?
2025-02-17 22:30:00,Order: I'd like a Vegan Burger combo with Sweet Potato Fries.
2025-02-17 23:05:00,I need to confirm my order for a Mediterranean Chickpea Salad.
2025-02-17 23:15:00,Order: I want a Freshly Squeezed Juice with extra lemon.
2025-02-17 23:25:00,"Your kitchen seems closed, but can I place an order anyway?"
2025-02-17 23:35:00,Order: I'd like a Chia Pudding dessert with fresh berries.
2025-02-17 23:45:00,Can I modify my order to remove extra dressing?
2025-02-17 23:55:00,Order: Give me a Vegan Burger with extra pickles and a Kombucha.
2025-02-18 00:10:00,"Hello, I'm just testing if orders are accepted after closing."
2025-02-18 00:20:00,"Order: I'd like a Grilled Veggie & Hummus Wrap, please."
2025-02-18 00:30:00,"I know you're closed, but can I still schedule a pickup for early tomorrow?"
2025-02-18 00:40:00,Order: I want a Vegan Burger with extra avocado and Cold Brew Coffee.
2025-02-18 01:05:00,Is anyone available to answer a quick question about your menu?
2025-02-18 01:15:00,Order: I'd like a Mediterranean Burger with extra olives.
2025-02-18 01:25:00,I'm just browsing at night; your system is still working!
2025-02-18 01:35:00,Order: Give me a Grilled Chicken Avocado Burger with no sauce.
2025-02-18 01:45:00,What's the estimated delivery time for orders placed at midnight?
2025-02-18 02:00:00,Order: I want Sweet Potato Fries and a Freshly Squeezed Carrot-Ginger Juice.
2025-02-18 02:15:00,Thanks for processing orders even when you're closed. I appreciate the service.
2025-02-18 02:45:00,"I hope the owner is getting some sleep, but the system is working perfectly!"
2025-02-18 03:00:00,"Order: I want a Vegan Burger with extra avocado, a Grilled Veggie & Hummus Wrap, and Kombucha."
2025-02-18 03:15:00,Everything looks great. Even late night orders are processed smoothly.
2025-02-18 03:45:00,Just checking: are orders accepted after midnight?
2025-02-18 04:00:00,Order: Please give me a Spicy Tempeh Burger and a Cold Brew Coffee.
2025-02-18 04:15:00,The system is still online. Thank you for working round the clock!
2025-02-18 04:30:00,Order: I want a Chia Pudding dessert and a Freshly Squeezed Juice.
2025-02-18 04:45:00,Your service is amazing. I can relax knowing orders are processed even at 4:45 AM.
2025-02-18 05:00:00,Order: I'd like a Vegan Burger combo with a side of Freshly Squeezed Carrot-Ginger Juice.
2025-02-18 05:10:00,Order: Can I get a Grilled Chicken Avocado Burger with extra spinach and no sauce?
2025-02-18 05:20:00,I'm wondering if I can place an order for pickup at 8am tomorrow?
2025-02-18 05:30:00,Order: I want a Mediterranean Burger with extra olives and a Cold Brew Coffee.
2025-02-18 05:45:00,Is the kitchen open yet? I'd like to know if orders can be processed early.
2025-02-18 06:00:00,Order: Please get me a Spicy Tempeh Burger with extra spice and a Kombucha.
2025-02-18 06:10:00,I have a question: Are there any vegan desserts on the menu?
2025-02-18 06:20:00,Order: I’d like a Chia Pudding dessert with fresh berries and a Freshly Squeezed Juice.
2025-02-18 06:30:00,"Good morning, I'm placing my order for tomorrow: Order: Vegan Burger with extra avocado, Sweet Potato Fries, and a Freshly Squeezed Carrot-Ginger Juice."
2025-02-18 06:40:00,Do you have any special promotions for first-time customers?
2025-02-18 06:50:00,Order: I want a Grilled Veggie & Hummus Wrap and a Cold Brew Coffee.
2025-02-18 07:00:00,I'm just checking if orders are automatically scheduled for the morning.
2025-02-18 07:10:00,Order: Please give me a Mediterranean Chickpea Salad with extra olives and a Freshly Squeezed Apple Juice.
2025-02-18 07:20:00,What's the estimated preparation time for an order placed at 7 AM?
2025-02-18 07:30:00,Order: I'd like a Vegan Burger combo with no sauce and a Cold Brew Coffee.
2025-02-18 07:40:00,I have a quick question: Can I modify an order after placing it?
2025-02-18 07:50:00,Order: I want a Grilled Chicken Avocado Burger with extra lettuce and a Kombucha.
2025-02-18 08:00:00,"Good morning, is your kitchen opening soon for breakfast orders?"
2025-02-18 08:10:00,Order: I'd like a Kale & Quinoa Super Salad with extra almonds and a Freshly Squeezed Juice.
2025-02-18 08:20:00,Can I schedule an order for pickup at 9 AM?
2025-02-18 08:30:00,Order: I want a Mediterranean Burger with extra feta and a Cold Brew Coffee.
2025-02-18 08:40:00,I have a question regarding your menu updates—will new items be added soon?
2025-02-18 08:50:00,"Order: Please give me a Grilled Veggie & Hummus Wrap, extra hummus, and a Freshly Squeezed Carrot-Ginger Juice."
2025-02-18 09:00:00,Can you confirm my order placed at 8:10 AM?
2025-02-18 09:10:00,"Order: I'd like a Vegan Burger with extra avocado, Sweet Potato Fries, and a Kombucha."
2025-02-18 09:20:00,I'm curious: Do you offer any loyalty rewards for frequent orders?
2025-02-18 09:30:00,Order: I want a Chia Pudding dessert with extra fresh berries and a Cold Brew Coffee.
2025-02-17 12:05:00,Order: I'd like to order The Green Garden Vegan Burger with extra avocado and Sweet Potato Fries.
